{"$comment":"Editor wiring (VS Code settings.json): \"json.schemas\": [{\"fileMatch\": [\"sora-extension.json\"], \"url\": \"./schema/manifest.schema.json\"}]. The CLI validate command enforces the rules this schema can only approximate (path safety, key formats, cross-field checks).","$id":"https://sora.app/schemas/extension-manifest-v1.json","$schema":"https://json-schema.org/draft/2020-12/schema","additionalProperties":false,"description":"sora-extension.json — normative spec: docs/extensions.md. The sora-ext CLI (validate/publish) is authoritative; this schema powers editor autocomplete and hover.","properties":{"author":{"additionalProperties":false,"properties":{"identity":{"description":"Verifiable handle, e.g. github:janedoe or an https URL.","maxLength":160,"minLength":1,"type":"string"},"name":{"description":"Display name of the author, e.g. Jane Doe.","maxLength":80,"minLength":1,"type":"string"},"public_key":{"description":"Minisign public key that signed the package (the base64 line of a .pub file). Paste the output of `sora-ext keygen` here.","minLength":1,"type":"string"}},"required":["name","identity","public_key"],"type":"object"},"background_task":{"additionalProperties":false,"description":"Optional: one periodic background task. Needs the background capability AND permission. The runtime clamps the effective interval into [15 min, 7 days].","properties":{"entry":{"description":"Worker script inside the package, e.g. worker.js. Relative .js path, no traversal.","type":"string"},"interval_minutes":{"description":"Desired period in whole minutes. Below 15 min is clamped to 15 min by the runtime.","maximum":10080,"minimum":1,"type":"integer"}},"required":["interval_minutes","entry"],"type":"object"},"capabilities":{"description":"Coarse feature areas. The permission list is what actually gates access.","items":{"enum":["theme","network-hook","routing","ui-panel","background","widget"],"type":"string"},"type":"array"},"description":{"description":"One or two sentences shown under the name in the store card.","maxLength":2000,"type":"string"},"id":{"description":"Reverse-DNS id with at least two labels, e.g. com.example.stats. Stable forever: the app uses it to track installs and updates.","pattern":"^[a-z0-9]([a-z0-9-]*[a-z0-9])?(\\.[a-z0-9]([a-z0-9-]*[a-z0-9])?)+$","type":"string"},"manifest_version":{"const":1,"description":"Must be 1. This is the only manifest version current Sora understands."},"min_app_version":{"description":"Oldest Sora version this extension works with, e.g. 1.9.0.","pattern":"^(0|[1-9][0-9]*)\\.(0|[1-9][0-9]*)\\.(0|[1-9][0-9]*)([-+][0-9A-Za-z.-]+)?$","type":"string"},"name":{"description":"Display name shown in the Extensions section.","maxLength":80,"minLength":1,"type":"string"},"network_hosts":{"description":"Host allowlist for net.fetch (needs the net.fetch permission). Lowercase DNS names or wildcards like *.example.com. No IPs, schemes, ports or paths.","items":{"minLength":1,"type":"string"},"maxItems":64,"type":"array","uniqueItems":true},"permissions":{"description":"Fine-grained access. The install prompt lists them; dangerous ones need explicit confirmation. Request only what you need.","items":{"enum":["connections.read","servers.read","settings.read","settings.write","notifications","tray","ui.panel","theme.apply","routing.rules","net.hooks","net.fetch","background"],"type":"string"},"type":"array","uniqueItems":true},"settings_schema":{"description":"JSON-Schema subset for the extension's own settings. The app auto-generates the settings form from it.","properties":{"properties":{"additionalProperties":{"properties":{"default":{"description":"Default value used until the user changes the setting."},"enum":{"description":"Allowed values (dropdown in the generated form).","type":"array"},"maxLength":{"minimum":0,"type":"integer"},"maximum":{"type":"number"},"minLength":{"minimum":0,"type":"integer"},"minimum":{"type":"number"},"type":{"enum":["string","integer","number","boolean"]}},"required":["type"],"type":"object"},"description":"Setting name -> declaration.","type":"object"},"type":{"const":"object"}},"type":"object"},"ui":{"additionalProperties":false,"properties":{"panels":{"description":"Panels embedded in the app. Each is plain HTML/JS; the only bridge to the app is window.soraExt.","items":{"additionalProperties":false,"properties":{"entry":{"description":"Relative .html path inside the package, e.g. panel.html. No traversal.","type":"string"},"id":{"description":"Unique within the extension, e.g. main.","pattern":"^[a-zA-Z0-9_-]{1,64}$","type":"string"},"title":{"description":"Tab title shown in the app.","maxLength":60,"minLength":1,"type":"string"}},"required":["id","title","entry"],"type":"object"},"type":"array"}},"required":["panels"],"type":"object"},"version":{"description":"Semver MAJOR.MINOR.PATCH. The catalog uses it to detect updates.","pattern":"^(0|[1-9][0-9]*)\\.(0|[1-9][0-9]*)\\.(0|[1-9][0-9]*)([-+][0-9A-Za-z.-]+)?$","type":"string"}},"required":["manifest_version","id","name","version","min_app_version","author","permissions","capabilities"],"title":"Sora extension manifest (v1)","type":"object"}